Policy,URL,Description,Source,Last updated,Learn more,Topics,Policy types,Sectors,Technologies,End uses,Country,Year,Status,Jurisdiction,country_code
JESSICA-F.I.D.A.E Fund (Energy Saving and Diversification Investment Fund),https://www.iea.org/policies/427-jessica-fidae-fund-energy-saving-and-diversification-investment-fund,"The aim of this fund is to finance urban sustainable development projects to improve energy efficiency, use renewable energies and be developed by energy services companies (ESCOs) or other private enterprises. This fund is to finance all the investments directly bound to the issue of energy efficiency and the use of renewable energies in urban environments, and it is compatible with other public or private funding sources, as well as with subsidies either co-funded or not by the FEDER. Priority issues:  Energy efficiency and energy management (existing and new buildings)  Renewable energy projects (solar thermal, solar PV, biomass)  Projects related to clean transport, contributing to improvement of energy efficiency and the use of renewable energies  These are the conditions that a project must meet to be fundable:  Being located in one of the Spanish Regions included in F.I.D.A.E. - Andalusia, the Canary Islands, Castile & Leon, Castile-La Mancha, Ceuta, Valencia, Galicia, Melilla & Murcia Region.  Being included in one of the following sectors:  Building: public and private buildings  Industry: firms of any size  Transport: infrastructures, equipment and both public and private transport fleet (for public use).  Public services infrastructures related to energy:  Outdoor public lighting and traffic lights.  Local infrastructures, inclusive of intelligent networks, information technology and communications (TIC) related to priority issues.  Take part in one of the priority issues:  Energy Efficiency Projects and energy management:  Renovation of existing buildings, with actions on the thermal envelope, heating installations, cooling, lighting, etc.  New buildings with energy rating A or B.  Renovation or enlargement of the heat/cool existing networks.  Renewable Energy Projects:  Solar thermal.  Solar PV if integrated in an energy efficiency project.  Biomass  Projects related to clean transport, contributing to improvement of energy efficiency and the use of renewable energies (electric recharge infrastructures for electric or plug-in hybrid vehicles, braking energy recovery from electric public transport, fleet management, electric or hybrid buses, etc.)  Ensuring an acceptable return of the investment.  Being included in an integrated plan for sustainable urban development  Not being finished on receiving the funding.  The management and marketing of JESSICA-F.I.D.A.E. Fund was entrusted by the EIB to BBVA through public tender",IEA/IRENA Renewables Policies Database,5 November 2017,https://www.idae.es/uploads/documentos/documentos_Guia_elegiblidad_v16_56e2ca80.pdf,Energy Efficiency|Renewable Energy,"Payments, finance and taxation|Payments and transfers|Grants","Buildings|Services|Industry|Transport|Power, Heat and Utilities|Power generation|Economy-wide (Multi-sector)|Electricity and heat generation",Solar PV|Solar thermal heaters|Solar,Undefined,Spain,2014,Ended,National,ESP
The STEP subsidy (Incentive scheme for energy performance in the rental sector),https://www.iea.org/policies/7733-the-step-subsidy-incentive-scheme-for-energy-performance-in-the-rental-sector,"The government is providing landlords in the social rental sector with a subsidy of € 400 million for investments in energy-efficiency in the 2014-2017 period with the aim of contributing to the objectives of the agreement on energy saving in the rental sector. The STEP subsidy encourages short-term investments to make residential rental properties energy-efficient. The scheme has been relaxed as of 1 July 2016 with the following changes,- the subsidy sums have been raised. This increase applies to new applications and with retroactive force for subsidies already awarded.- in order to encourage extremely energy efficiency renovation, a subsidy is now also awarded for renovations that exceed the Energy Index (EI) of 1.20. This means that extremely energy efficient renovations such as nearly zero energy homes or energy-neutral homes receive a greater subsidy than previously. The minimum improvement under the Energy Index is, for a number of specific cases, lowered from class 3 to class 2. This means that more houses will be eligible for a subsidy. The link to the Energy Agreement does however remain in place (in 2020 average label B in the social rental sector and a minimum label C for 80% of private rental properties).",Undefined,8 November 2019,"https,//www.rvo.nl/subsidies-regelingen/stimuleringsregeling-energieprestatie-huursector-step",Energy Efficiency,"Payments, finance and taxation|Payments and transfers|Grants",Buildings|Residential,Undefined,Undefined,Netherlands,2014,Ended,National,NLD
Financial aid programme for energy savings and renewable energy in housing 2013,https://www.iea.org/policies/1599-financial-aid-programme-for-energy-savings-and-renewable-energy-in-housing-2013,"The regulation of 12 December 2012 sets up a new financial aid scheme called  ""PRIMe House €. The regulation went into force on 1 January 2013 superseding regulation in force between  2008 and 2012.Scheme provides financial support in form of grants for projects aiming to improve energy savings and usage of renewable energy sources in the building sector.  The scheme focus is on renovation and improvement of already existing households and enactment of new households with high energy efficiency indicators and substantial usage of renewable energy sources.Only private homeowners can benefit from the scheme.Levels of the support possible:Individual homeowners can benefit from up to EUR 15000 for households with low energy consumption;Less energy efficient households for renovation and installations or energy efficient and renewable energy technologies can receive up to EUR 40000 in grants.  Individuals installing following renewable installations can benefit from the support:Solar thermal installations;Solar PV;Heat pumps;Wood boilers;",IEA/IRENA Renewables Policies Database,5 November 2017,http://www.legilux.public.lu/leg/a/archives/2012/0264/a264.pdf#page=2,Energy Efficiency|Renewable Energy,"Payments, finance and taxation|Payments and transfers|Grants","Buildings|Residential|Power, Heat and Utilities|Power generation|Heating and Cooling|New buildings|Existing buildings and retrofits|Electricity and heat generation","Space, water and process heating technologies|Solar PV|Solar thermal heaters|Solar|Heat pumps",Undefined,Luxembourg,2013,In force,National,LUX
Legislative Decree 4 June 2013 (DL 4/6/2013) - Transposition of the European Directive 2010/31/UE on the energy performance of buildings,https://www.iea.org/policies/1355-legislative-decree-4-june-2013-dl-462013-transposition-of-the-european-directive-201031ue-on-the-energy-performance-of-buildings,"Law of 3 August 2013, n. 90, recently published in the official gazette, converted into law (with amendments) the Decree- Law no. 63 of 2013 on  ""Urgent measures for the transposition of Directive 2010/31/EU of the European Parliament and of the Council of 19 May 2010 on the energy performance of buildings . It supersedes the Legislative Decree 192/2005 about the transposition of the Directive 2002/91/CE on the energy performance of buildings. Objectives of the Decree are as followings: -encourage improvements in the energy performance of buildings;-encourage the development , enhancement and integration of renewable energy sources in buildings;-to support energy diversification;-promote the competitiveness of the domestic industry through technological development ;achieve the national targets for energy and the environment;-extend and enhance the system of tax deductions (""detrazione"") from 55 % to 65% (10 equal yearly amounts) for the redevelopment of Buildings (Eco- bonus), building renovations, the installation of RES-H technologies (e.g. 60% for heat pumps, solar thermal collectors, 50% for biomass-fueled heat generators (since 2017(-Art. 3, par. 4 L 205/17)) . In the case of private individuals, this disposition is valid for works undertaken up to 31 December 2018 and in the case of common buildings the disposition is valid up to 31 December 2021. For energetic requalification works aimed at improving the winter and summer energy performance of common buildings, the tax deduction will amount to 70% or 75% and works can be undertaken between 1st January 2017 and 31 December 2021 (Art. 1.2, par. a.3 L 232/16). The maximum amounts for the tax deduction scheme are:-Aerothermal and Geothermal: € 30,000, to be distributed over three years with three quotas of equal amount (Art. 1, c. 347, l. 296/06 in conjunction with Art. 1, c. 286, l. 244/07). -Solar Thermal plants: € 60,000, to be distributed over ten years with ten quotas of equal amount (Art. 1, c. 346, l. 296/06 in conjunction with Art. 1, c. 48, l. 220/10). -Energetic requalification works aimed at improving the winter and summer energy performance of common buildings : €40,000, to be distributed over ten years with ten quotas of equal amount (Art. 1.2-quarter L 232/16).  The tax deduction (“detrazione”) is conceded only if installation is validated by a certified technician (Art. 1, c. 348, l. 296/06) (except for solar thermal)  In order to implement the Directive on the energy performance 2010/3/UE, the decree: - adopts at the national level a methodology for calculating the energy performance of buildings, taking into account, among other things, the thermal characteristics of the building and of air-conditioning and hot water supply;- provides minimum energy efficiency requirements to achieve levels of optimal cost. The requirements to be applied to new buildings and those undergoing major renovation or upgrading the energy efficiency are reviewed every 5 years;- defines ""nearly zero energy buildings"" and is drawn up a strategy for their growth through the implementation of a national plan, to be determined by 30.06.2014, which includes an indication of the way in which it applies this definition, intermediate targets for improving the energy performance of new buildings by 2015, information on the policies and financial measures or other measures taken to promote the improvement of the energy performance of buildings.",IEA/IRENA Renewables Policies Database,3 December 2019,http://www.normattiva.it/uri-res/N2Ls?urn:nir:stato:decreto.legge:2013-06-04;63!vig=,Energy Efficiency|Renewable Energy,"Regulation|Audits and inspections|Codes and standards|Building codes and standards|Payments, finance and taxation|Taxes, fees and charges|Payments and transfers|Tax credits and exemptions|Prescriptive requirements and standards",Buildings|Heating and Cooling,Solar thermal heaters|Geothermal electricity|Electric air-source heat pumps|Geothermal|Biomass and renewable waste,Undefined,Italy,2013,In force,National,ITA
Plan for Promoting Energy Rehabilitation of Hotel Sector,https://www.iea.org/policies/1062-plan-for-promoting-energy-rehabilitation-of-hotel-sector,"The Plan to Promote the Environment in the hotel sector, PIMA SOL, approved in Cabinet Meeting on 2 August 2013, was an initiative devoted to reducing greenhouse gas emissions (GHG) in the Spanish tourism sector through the energy renovation of hotel installations. The Ministry of Agriculture, Food and the Environment purchased the greenhouse gas emission reductions that were generated in hotels through renovation projects, with a financial aid package allocation of M€5.21. The Plan will also counted on the financing of the European Investment Bank (EIB), which approved on 29 July 2013 a line worth M€ 200 through Spanish banks. The latter would in turn, contribute another M€ 200 with very advantageous interest rates and repayment periods. The beneficiaries of PIMA SOL were hotel facilities with energy renovation projects meeting the minimum conditions set out in the Plan. Renovation projects were to reach a minimum energy improvement rate that would translate in, at least, two letters higher on the energy rating or else, reach letter B. Some of the measures included in the Plan are the insulation improvement actions for façades, windows and roofs; the inclusion of control systems for heating & cooling, and lighting; plate water-heating systems; passive heating and cooling systems attained with smarter architecture; more efficient heat-cool equipment; geothermal energy and biomass in heating & cooling; and water-efficient management systems.  Royal Decree 635/2013, of 2 August, developing the “Plan to Promote the Environment in the hotel sector PIMA SOL"", for the energy renovation of its installations, and regulating the further acquisition of carbon credits by the Carbon Fund for a sustainable economy.",Undefined,5 November 2017,Undefined,Energy Efficiency,"Payments, finance and taxation|Investment in assets|Performance-based payments|Payments and transfers|Feed-in tariffs/premiums|Finance",Buildings|Services|Industry|Existing buildings and retrofits,Industry sector-specific processes and technologies|Manufacuturing technologies and systems,Undefined,Spain,2013,Ended,National,ESP
Danish Energy Agreement for 2012-2020,https://www.iea.org/policies/606-danish-energy-agreement-for-2012-2020,"The Agreement establishes a framework for the policy on climate and energy up to 2020 and outlines the direction  Denmark will take until 2050. According to the Agreement in 2020 half of the electricity consumption will come from wind power, enabling a share of 35% renewable energy in gross energy consumption in 2020. Moreover, the energy consumption is to decrease by more than 12 % in 2020 compared to 2006. The initiatives in the Agreement will lead to CO2 emissions in 2020 being  34% lower than they were in 1990. At the same time, the Agreement is to ensure a stable framework for the business community as a whole, and the energy sector in particular.   Renewable energy in power generation The Agreement secures substantial expansion of wind power, corresponding to the annual consumption of 1 ½ million households. Thus in 2020, wind power will account for approximately 50% of Danish electricity consumption. The Agreement implies that: 600 MW offshore wind turbines will be built at Kriegers Flak and 400 MW offshore wind turbines will be built at Horns Rev before 2020; a further 500 MW offshore wind turbines will be installed near the coast before 2020; new planning tools will encourage development of onshore wind turbines with a total capacity of 1,800 MW up until 2020; over a period of four years, a total of DKK 100 million will be committed to funding development and use of new renewable energy technologies for electricity production (solar, waves ,etc.) as well as DKK 25 million for wave power demonstration facilities. Energy-efficiency  measures With the Agreement initiatives, in 2020 Denmark will have reduced its final energy consumption (excluding consumption for transport) by almost 8% compared to 2010. The Agreement contains the following elements: energy companies must realise specific energy savings exceeding today requirements, e.g. by consulting energy experts and by offering subsidies to e.g. households and businesses; energy companies must increase efforts by 75% from 2013 to 2014, and by 100% from 2015 to 2020 compared to 2010-12; a comprehensive strategy for energy renovation of all Danish buildings will be developed. Green heating measures: converting from coal to biomass at large-scale power plants will be made more attractive by amending the Heating Supply Act; the smaller open-field plants that are struggling in the wake of high heating prices will be allowed to produce cheap heating based on biomass; DKK 35 million will be committed to promoting new renewable technologies, e.g. geothermal energy and large heat pumps. Renewable energy in buildings   The Agreement supports the phasing-out of oil-fired boilers in existing buildings by: banning installation of oil-fired boilers and natural gas boilers in new buildings from 2013; banning installation of new oil-fired boilers in existing buildings in areas where district heating or natural gas is available from 2016; committing DKK 42 million in 2012-15 to fund the conversion from oil-fired boilers and natural gas boilers in existing buildings to renewable energy. Renewable energy in industry Industry must also convert to a greener energy system. Therefore the Agreement lays down that: -                a subsidy should be given to help promote investment in energy efficient use of renewable energy in the production processes of enterprises. In the period 2014 to 2020, the subsidy will be increased to DKK 500 million a year from DKK 250 million in 2013: -                  funding of DKK 30 million per year from 2013 to 2020 will be introduced to maintain and promote industrial CHP in industries and greenhouses. Deployment of Smart Grids Large electricity consumption in combination with wind power requires an intelligent energy system. Therefore the Agreement lays down that: a comprehensive strategy for establishing smart grids in Denmark is to be drawn up; An expansion of biogas is also to be implemented. In order to create momentum in this must improve the economic conditions for biogas production and biogas must to a greater extent than today could be used outside the cogeneration sector. The parties are, therefore, agree that it total support for biogas used for cogeneration or sent out into the natural gas network should be able toreceive support of DKK 115 / GJ in 2012;  In the long term, the transport sector must undergo a radical transformation from fossil fuels to new ones propellants such as electricity and biomass; Investments in research, development and demonstration are prerequisites for Danish companies in so that they can develop and sell green solutions and create green jobs in the long term.",IEA/IRENA Renewables Policies Database,14 September 2020,https://ens.dk/sites/ens.dk/files/EnergiKlimapolitik/aftale_22-03-2012_final_ren.doc.pdf,Energy Efficiency|Technology R&D and innovation|Renewable Energy,"Regulation|Payments, finance and taxation|Targets, plans and framework legislation","Buildings|Industry|Power, Heat and Utilities",Geothermal electricity|Electricity generation and CHP technologies,Undefined,Denmark,2012,Ended,National,DNK
"Building Renovation Program (Das Gebäudeprogramm, Le Programme Bâtiments)",https://www.iea.org/policies/5024-building-renovation-program-das-gebaudeprogramm-le-programme-batiments,"The Building Programme has been implemented to encourage energy efficient renovation of old buildings with the purpose of lowering greenhouse gas emissions (mostly CO2). The Building Programme is executed together with almost all of Switzerland's cantons, who encourage the use of renewable energy, waste heat, improved building technology and also total building renovation. A small portion of the CO2-levy from the use of fossil fuels in stationary applications (Fr. 30 million per year) is administered directly by the Confederation to encourage the direct use of geothermal energy for heating purposes in buildings provided their greenhouse gas emissions (particularly CO2) are reduced.",IEA/IRENA Renewables Policies Database,19 July 2018,http://www.dasgebaeudeprogramm.ch/index.php/fr,Renewable Energy,"Payments, finance and taxation|Funds to sub-national governments|Payments and transfers|Grants","Buildings|Power, Heat and Utilities|Power generation|Combined heat and power|Heating and Cooling|Electricity and heat generation",Combined heat and power (CHP),Undefined,Switzerland,2010,Ended,National,CHE
Energy efficiency measures for fuel poverty alleviation (Living Better Programme),https://www.iea.org/policies/8515-energy-efficiency-measures-for-fuel-poverty-alleviation-living-better-programme,"Habiter mieux is a program of the ANAH (Agence national de l'habitat) which finance a set of renovation interventions aiming at realising comprehensive thermal renovations of homes of low-income households. The maximum amount of funding for a recepient is between 7000 and 10000 euros according to the income of the recipient.  ""Very low-income households"" are entitled to: 50% of the renovation expenses up to 10000 euros a premium of 10% of the total amount of renovation expenses up to 2000 euros ""Low-income households"" are entitled to: 35% of the renovation expenses up to 7000 euros a premium of 10% of the total amount of renovation expenses up to 1600 euros In order to define which are the best renovation interventions the occupying owner is accompanied by a consultant-operator. In order to finance this procedure a grant of 573 euros is provided. This support scheme can be combined with other support schemes such as Crédit d’Impôt pour la Transition Energétique (CITE) et l’Eco-prêt à taux zéro (Eco-PTZ),",Undefined,7 November 2019,https://www.eceee.org/library/conference_proceedings/eceee_Summer_Studies/2015/6-policies-and-programmes-towards-a-zero-energy-building-stock/alleviating-fuel-poverty-through-energy-efficiency-measures-the-french-programme-habiter-mieux/,Energy Efficiency,"Payments, finance and taxation|Payments and transfers|Grants",Buildings|Residential|Existing buildings and retrofits,Building envelope technologies,Undefined,France,2010,Ended,National,FRA
National commitment to the environment - Grenelle 2,https://www.iea.org/policies/408-national-commitment-to-the-environment-grenelle-2,"Grenelle 2 is the law establishing France ""national commitment to the environment,"" and corresponds to the implementation of part of the Grenelle Environment Forum suggestions. Objective: design and construct buildings more energy-conscious and better coordinated with the planning policies of housing, commercial development and transportation, while improving the quality of life for residents. Action taken: Support technological advancements, promote efficient urban land resources and energy use, organise transport to provide for public mobility needs while being environmentally friendly. Beginning in 2020, new buildings must be energy positive. Starting in 2013, renovation of old buildings must happen at a rate of 400,000 per year. Objective: upgrade transport infrastructure and behaviour. Action taken: Develop urban public transport, suburban and high speed, develop electric vehicles and plug-in hybrids, experiment with congestion charging, and encourage rail freight and shipping, reduce energy consumption and their carbon emissions. Objective: drastically reduce emissions of greenhouse gases by saving energy and making cities more carbon-free.Action taken: Promote the development of renewable energy, enforce and expand mandatory environmental labelling on products, conduct assessments of greenhouse gas emissions and develop an action plan to reduce them, and extend energy efficiency certificates. Objective: ensure a proper functioning of ecosystems by protecting species and habitats. Aciton taken: develop the Green and Blue, make agriculture sustainable, protect wetlands and drinking water catchments, supervise on-site sanitation and fight against water losses in networks, protect the sea and coastline and work to preserve biodiversity. Objective: establish the necessary tools to start an ecological democracy, as in the private sector in the public sphere.Action taken: develop reports on social and environmental aspects, in addition to financial reports; strengthen public consultation guidelines; reform the EESC and the CESR; designate representative environmental associations to participate in institutional dialogues; and enforce risk control, waste treatment, and health maintenance. Objective: Protect the health of everyone and respect the environment by preventing risks, fighting against all forms of pollution, and managing waste more sustainably. Action taken: fight against air pollution, light pollution, and noise; extend the means to fight against floods; consider emerging risks (nanosubstances, electromagnetic waves); implement a sustainable waste management system.",IEA/IRENA Renewables Policies Database,7 November 2019,https://www.ademe.fr/expertises/batiment/elements-contexte/politiques-vigueur/lois-grenelle-transition-energetique-croissance-verte,Energy Efficiency|Renewable Energy,"Regulation|Information and education|Payments, finance and taxation",Buildings|Transport|Economy-wide (Multi-sector),Undefined,Undefined,France,2010,In force,National,FRA
