Policy,URL,Description,Source,Last updated,Learn more,Topics,Policy types,Sectors,Technologies,End uses,Country,Year,Status,Jurisdiction,country_code
Medium and Long-term Plan of Energy Conservation: 10 Energy Conservation Programmes,https://www.iea.org/policies/709-medium-and-long-term-plan-of-energy-conservation-10-energy-conservation-programmes,"Launched in 2004, the Medium and Long-term Plan of Energy Conservation covers the 2005-10 and the 2010-20 period. It details energy conservation aims and implementation plans to be undertaken during the 11th five year period (2006-10) and beyond. The Plan puts forward ten key energy conservation programmes.These include programmes to upgrade coal-burning kilns and electric motor systems, improve district co-generation, and undertake fuel switching and conservation activities (see separate entries). The other six programmes are:Residual heat and pressure useIron and steel enterprises are to apply coke dry quenching and recover waste energy from blast furnaces for energy production, as well as renovate blast furnace gas power generation and implement converter gas recovery.Optimise energy systems in major industries, primarily metallurgical, petrochemicals and chemicals.Adopt energy conservation standards for buildings (see separate entry).Promote energy conservation in government agencies, including through building efficiency as well as equipment and vehicle procurement.Monitoring and Technical Services: Energy and energy-saving monitoring centres in provinces and major industries are to be improved, through upgrading of equipment, training of personnel, and promoting energy service contracts.Such centres would provide a range of energy services, from diagnosis, design, financing, renovation, operation and management.Green Lighting: Replacement of ordinary incandescent lamps with high-efficiency compact fluorescent light bulbs (CFLs), replacement of traditional electromagnetic ballast with electronic ballast, and using light emitting diodes (LEDs) in traffic lights.",Undefined,16 April 2021,http://en.ndrc.gov.cn/,Energy Efficiency,"Regulation|Codes and standards|Payments, finance and taxation|Operational funding for institutions|Public procurement",Buildings|Residential|Services|Industry|Transport,Industry sector-specific processes and technologies|Manufacuturing technologies and systems|Motors,Undefined,People's Republic Of China,2004,In force,National,CHN
"Financial measures for  houses (subsidy, tax, preferential loan)",https://www.iea.org/policies/1382-financial-measures-for-houses-subsidy-tax-preferential-loan,"The government promotes the diffusion of energy efficient houses and buildings by providing special financial or tax incentives as follows:1. Low interest loan programme for energy conservation renovation of buildings: Targeted for energy conservation renovation projects for existing buildings using ESCOs (Energy Service Company), companies that provide energy efficiency improvement services and advice to the client. Funds may be provided to execute these projects by a way of leasing or an Energy Service Provider (ESP). This business provides expertise on energy conservation measures, managing multiple workplaces in an integrated manner.2. Low interest loan programme for plans for environmentally-friendly buildings these are provided for specific measures taken in the planning phase, such as energy conservation measures, roof-top greening projects, etc.3. Tax Scheme for Promoting Investment in the Reform of the Energy Demand-Supply Structure This scheme is available for businesses that acquire specified energy conservation equipment. It provides special depreciation rate applied for 30% of the acquisition cost (small scale businesses are provided with the option of a 7 % tax deduction of the acquisition cost). Demand leveling facilities and multiplexing electricity distribution facilities benefit from a special depreciation rate applying to 50% of the acquisition cost. Since fiscal year 2006, highly-efficient equipment and systems used in the residential and commercial sectors, such as highly efficient air conditioning systems, high insulation windows facilities, and light-emitting diodes, are covered by this scheme.4. The Japan Housing Finance Agency (JHF) (previously Government Housing Loan Corporation, GHLC) allows for lower interest rates and preferential loans to be provided for energy efficient houses. The GHLC provided an extra loan for houses meeting energy saving performance, earthquake resistance performance or elderly and handicapped performance technical standards set by the GHLC.For energy performance, all the houses for which the loan was requested had to meet at least the 1980 thermal insulation standard. On top of that, an extra loan was provided for those meeting the 1992 or 1999 standards. In 2003 direct loans were no longer provided, and the JHF began underwriting a long-term and fixed interest rate loan called ""Flat 35"", with energy conservation performance one of the items evaluated to determine loan conditions. All houses applying for the loan must meet 1980 thermal insulation standards, and reduced interest rates are provided for those meeting the 1999 standards.5. Promoting energy-efficient public housing buildings, through the Organisation for Promoting Urban Development, which comply with specified energy conservation levels. Subsidies are also provided to housing facilities that comply with 1999 energy conservation standards, setting more rigorous criteria for environmental, resource and energy use.Subsidy for ""Install high efficient building materials to existing houses and building ""was issued. Its application period was from Mar 31, 2015 to Aug 31,2015 (separated to 4 times). Total budget was 7.3 billion yen.",Undefined,5 November 2017,http://www.enecho.meti.go.jp/category/saving_and_new/saving/pdf/current_situation_japanese.pdf,Energy Efficiency,"Payments, finance and taxation|Taxes, fees and charges|Payments and transfers|Tax credits and exemptions|Grants",Buildings|Residential|Services|New buildings|Existing buildings and retrofits,Undefined,Undefined,Japan,2002,In force,National,JPN
Incentives for Low-energy Housing,https://www.iea.org/policies/1475-incentives-for-low-energy-housing,"The Norwegian State Housing Bank assists with achieving Norway's national environmental targets by encouraging the construction of more environment-friendly housing, for example by stimulating low energy consumption. The Housing Bank supports projects that contribute to capacity building; those with a high level of ambition and a high transfer value. The basis for the Housing Banks environmental work is the environmental action plan for 2009 - 2012, issued by the Ministry of Local Government and Regional Development. Almost half of all new homes with a loan through the Housing Bank have specific environmental qualities. Projects focusing on low-energy housing, ""passive"" houses and environmentally friendly renovations and modernizations are prioritized, and nearly half of these have implemented energy saving measures. In new buildings, the energy saving is 40 percent or more, and for renovated buildings 20 - 40 percent.",Undefined,5 November 2017,http://www.husbanken.no/tilskudd/tilskudd-kompetansetilskudd/kompetansetilskudd_bolig-og-bygg/,Energy Efficiency,"Payments, finance and taxation|Payments and transfers|Loans / debt finance|Finance|Grants",Buildings|Residential|New buildings|Existing buildings and retrofits,Undefined,Undefined,Norway,2002,In force,National,NOR
Building Retrofit Subsidies: PANEL programme,https://www.iea.org/policies/2212-building-retrofit-subsidies-panel-programme,"The Ministry of Regional Development (MRE) through the State Housing Development Fund provides support for the repair, reconstruction and modernisation of apartment buildings constructed using the concrete panel technology, of which there are more than 1.1 million apartments in the Czech Republic. Financial subsidies are provided along with contributions to cover interest and guarantees for activities related to repairs and reconstruction of concrete panel apartment buildings; non-apartment residential units are explicitly excluded from the programme. Preference is given to economically depressed areas and areas with disturbed environment. Support is also provided for insulating buildings, improving heating systems, distribution pipes and sources of heat and hot tap water, and use of renewable energy sources in buildings which could have a favourable effect on energy efficiency, and thus on GHG emissions. The Panel programme was modified in May 2009, and continues to provide, in partnership with banks, preferential treatment when receiving loans, as well as subsidy payments to reduce loan interest. The programme applies to owners, who can receive guarantees for loans used to undertake a list of measures. When significant renovation or repair activity is undertaken affecting the building envelope, the building must then meet building energy performance standards. In addition, the programme offers subsidies amounting to between 2.5% and 4% of applicants loan interest rate. A higher proportion of the interest is reimbursed if more measures are undertaken, or if the building meets Class B energy performance standards. The subsidy is provided up to a maximum of CZK 5 500 per m2 of floor area, and paid every six months for the duration of the loan.",IEA/IRENA Renewables Policies Database,4 July 2019,Undefined,Energy Efficiency|Renewable Energy,"Payments, finance and taxation|Payments and transfers|Loans / debt finance|Finance","Buildings|Residential|Power, Heat and Utilities|Power generation|Economy-wide (Multi-sector)|Heating and Cooling|Existing buildings and retrofits|Electricity and heat generation",Undefined,Undefined,Czech Republic,2001,Ended,National,CZE
Investing in the Future Programme,https://www.iea.org/policies/1157-investing-in-the-future-programme,"Special Funding Programme for 2001-2003 to endorse energy research in the following fields : - Fuel cells (stationary and mobile applications) received about EUR 63 million; - Alternative vehicle propulsion (e.g. high performance batteries) and regenerative fuel production (e.g. hydrogen, methanol) received about EUR 15 million; - Geothermal energy production (heat and electricity) received about EUR15 million; - Offshore wind energy received about EUR 15 million; and - Renovation of existing buildings (energetic aspects) received about EUR15 million. The total budget for 2001-2003 was EUR 123 million, or EUR 41 million per year.",IEA/IRENA Renewables Policies Database,24 August 2021,Undefined,Energy Efficiency|Technology R&D and innovation|Renewable Energy,"Payments, finance and taxation|Payments and transfers|Targets, plans and framework legislation|Grants",Buildings|Transport,Undefined,Undefined,Germany,2001,Ended,National,DEU
Energy Efficiency Grants for Households - SZT-EN-1 and SZT-LA-2 Programmes,https://www.iea.org/policies/1503-energy-efficiency-grants-for-households-szt-en-1-and-szt-la-2-programmes,"To modernise the large number of poorly insulated housing blocks, Hungary launched a reconstruction programme (the SZT-EN-1 Programme) within the Szecheni Plan. The programme offers a non-reimbursable grant (of up to Ft 60 000 per apartment) to people wishing to make energy efficiency investments (for example, in heating reconstruction, additional insulation and window and door replacements) in their houses.  In 2001, the Energy Centre supported around 4 000 applications; total grants amounted to Ft 1.51 billion. In 2002 out of 8 400 applications 7 900 were supported (the rest were not because of lack of available grant) and may reached Ft 2 475 billion for 2002.  Additional support is available through the National Energy Efficiency Programme. This programme is also managed by the Energy Centre and the available amount for the year 2003 is Ft 2.97 billion. The SZT-LA 2 Programme offers non-refundable grants to carry out energy efficient renovations in residential buildings made with prefabricated technology and for retrofitting of company buildings with industrial technology (block houses). In 2001, total grants amounted to Ft 2 billion.",Undefined,7 October 2019,Undefined,Energy Efficiency,"Payments, finance and taxation|Payments and transfers|Grants",Buildings|Residential|Existing buildings and retrofits,Building envelope technologies,Undefined,Hungary,2000,In force,National,HUN
Renovation of street lighting (Phase II funding),https://www.iea.org/policies/2658-renovation-of-street-lighting-phase-ii-funding,"The purpose of allocating grants is to increase the efficiency of consumption of electrical energy in street lighting. As a result of the support, the consumption of electrical energy in street lighting will decrease as a result of the use of more efficient LED-lighting technology. The project contributes to achieving the following output figures of the activities under the measure:  decreased consumption of electrical energy in street lighting; increased number of renovated street lighting points; calculated annual decrease of CO2.  Older lamps are changed for LED and smart technology.  Grants are available covering 35 to 80% of eligible project costs",Undefined,18 October 2019,https://www.kik.ee/en/supported-activity/renovation-street-lighting-infrastructure,Cities|Energy Efficiency,"Payments, finance and taxation|Payments and transfers|Grants",Buildings,Lighting technologies|Exterior lighting (incl. street),Undefined,Estonia,2016,Ended,National,EST
Programme of Public building renovation,https://www.iea.org/policies/1267-programme-of-public-building-renovation,"The 2020 target set in this Programme is to renovate 700 000 m2 of the public buildings by saving 60 GWh of the annual primary energy and to reduce GHG emissions by 14 thou. kt.It is planned to renovate public buildings by reaching C class of energy utility. In this Programme it is defined that the total area of public houses which are owned by the state and municipalities is 14.8 million m2 (approximately 35% of all are non-residential buildings), for the heating all these building approximately 2 300 GWh of heat energy is used.",Undefined,5 November 2017,Undefined,Energy Efficiency,"Payments, finance and taxation|Funds to sub-national governments|Investment in assets|Payments and transfers|Finance",Buildings|Services|Existing buildings and retrofits,Undefined,Undefined,Lithuania,2014,In force,National,LTU
Multi-apartment Building Renovation (Modernization) Programme,https://www.iea.org/policies/886-multi-apartment-building-renovation-modernization-programme,"Programme of Modernization of Multi-apartment Buildings was approved in 2004. In 2009 essential adjustments were adopted which have changed the financing rules. Due to this the modernization process was slowed down in 2009 while the owners of multi-apartment buildings were waiting for the determination of the new explicit rules for financing. However, in 2012 Programme of Modernization of Multi-apartment Buildings was changed again, this time enhancing implementation of actual modernisation projects. More detailed information is available in the National Reform Programme 2014.The main aim of the Programme is to reduce thermal energy use in multi-apartment buildings, built before 1993, at least by 20% by the end of 2020, i.e. estimated annual energy consumption in these buildings by the end of 2020 should be reduced at least by 1000 GWh/year, and reduce GHG emissions by 230 ktCO2eq/year, comparing with 2005.",Undefined,5 November 2017,Undefined,Energy Efficiency,"Payments, finance and taxation|Payments and transfers|Loans / debt finance|Finance|Grants",Buildings|Residential|Existing buildings and retrofits,Undefined,Undefined,Lithuania,2004,In force,National,LTU
